{
	"id": "oqto-slate",
	"name": "Oqto Slate",
	"mode": "light",
	"system": "base24",
	"slots": {
		"base00": "#b3bab5",
		"base01": "#dfe3e0",
		"base02": "#bdd4c6",
		"base03": "#58635d",
		"base04": "#414c46",
		"base05": "#121915",
		"base06": "#0c120f",
		"base07": "#070b09",
		"base08": "#86101b",
		"base09": "#6f3100",
		"base0A": "#524000",
		"base0B": "#0d5e42",
		"base0C": "#004b46",
		"base0D": "#01437e",
		"base0E": "#523378",
		"base0F": "#583d29",
		"base10": "#d4dad5",
		"base11": "#cbd1cc",
		"base12": "#8a1f24",
		"base13": "#564700",
		"base14": "#005335",
		"base15": "#00514d",
		"base16": "#14497e",
		"base17": "#563b78"
	},
	"roles": {
		"border": "base03",
		"input": "base03",
		"muted": "base10"
	},
	"overrides": {
		"--primary-foreground": "#ffffff",
		"--success-foreground": "#ffffff",
		"--warning-foreground": "#ffffff",
		"--info-foreground": "#ffffff",
		"--destructive-foreground": "#ffffff",
		"--sidebar-primary-foreground": "#ffffff",
		"--chart-1": "#0d5e42",
		"--chart-2": "#58635d",
		"--chart-3": "#4d5852",
		"--chart-4": "#414c46",
		"--chart-5": "#2a332e",
		"--terminal-bg": "#cbd1cc",
		"--code-bg": "#d1d7d2",
		"--code-inline-bg": "#cbd1cc",
		"--code-fg": "#121915",
		"--code-border": "#959d98",
		"--code-accent": "#0d5e42",
		"--code-success": "#005035"
	}
}
