{
	"id": "oqto-dark",
	"name": "Oqto Dark",
	"mode": "dark",
	"system": "base24",
	"slots": {
		"base00": "#222624",
		"base01": "#2d312f",
		"base02": "#3a3f41",
		"base03": "#6b7974",
		"base04": "#b2b9b5",
		"base05": "oklch(0.8008 0.0079 228.8806)",
		"base06": "#f2f5f3",
		"base07": "#f5f5f5",
		"base08": "#b94a48",
		"base09": "#c98a5a",
		"base0A": "#d4c275",
		"base0B": "#3ba77c",
		"base0C": "#3ba7a0",
		"base0D": "#5b8fc9",
		"base0E": "#a78bd0",
		"base0F": "#8a6f5a",
		"base10": "#161c1a",
		"base11": "#0f1412",
		"base12": "#d96b69",
		"base13": "#e6d488",
		"base14": "#5bc79a",
		"base15": "#5bc7c0",
		"base16": "#7bace0",
		"base17": "#c0a3e0"
	},
	"overrides": {
		"--chart-1": "#3ba77c",
		"--chart-2": "#727272",
		"--chart-3": "#8a8a8a",
		"--chart-4": "#9f9f9f",
		"--chart-5": "#b2b2b2",
		"--terminal-bg": "#0b0d12",
		"--code-bg": "#1a201e",
		"--code-inline-bg": "rgba(255, 255, 255, 0.07)",
		"--code-fg": "#d5f0e4",
		"--code-border": "#2a3632",
		"--code-success": "#a3d9c0"
	}
}
