{
	"id": "oqto-light-v2",
	"name": "Oqto Light v2 (green-tinted mirror)",
	"mode": "light",
	"system": "base24",
	"slots": {
		"base00": "oklch(0.970 0.005 165)",
		"base01": "oklch(0.928 0.006 165)",
		"base02": "oklch(0.895 0.012 165)",
		"base03": "oklch(0.620 0.015 165)",
		"base04": "oklch(0.500 0.012 165)",
		"base05": "oklch(0.300 0.010 165)",
		"base06": "oklch(0.205 0.008 165)",
		"base07": "oklch(0.150 0.005 165)",
		"base08": "oklch(0.520 0.150 24)",
		"base09": "oklch(0.580 0.110 57)",
		"base0A": "oklch(0.560 0.110 96)",
		"base0B": "oklch(0.470 0.115 163)",
		"base0C": "oklch(0.520 0.085 189)",
		"base0D": "oklch(0.520 0.115 252)",
		"base0E": "oklch(0.550 0.115 302)",
		"base0F": "oklch(0.480 0.050 59)",
		"base10": "oklch(0.940 0.006 165)",
		"base11": "oklch(0.915 0.009 165)",
		"base12": "oklch(0.600 0.150 24)",
		"base13": "oklch(0.680 0.110 96)",
		"base14": "oklch(0.580 0.120 163)",
		"base15": "oklch(0.580 0.090 189)",
		"base16": "oklch(0.580 0.110 252)",
		"base17": "oklch(0.620 0.110 302)"
	},
	"overrides": {
		"--chart-1": "oklch(0.470 0.115 163)",
		"--chart-2": "oklch(0.550 0.012 165)",
		"--chart-3": "oklch(0.480 0.012 165)",
		"--chart-4": "oklch(0.420 0.012 165)",
		"--chart-5": "oklch(0.380 0.012 165)",
		"--terminal-bg": "oklch(0.915 0.009 165)",
		"--code-bg": "oklch(0.928 0.006 165)",
		"--code-inline-bg": "oklch(0.895 0.012 165)",
		"--code-fg": "oklch(0.300 0.010 165)",
		"--code-border": "oklch(0.860 0.010 165)",
		"--code-accent": "oklch(0.470 0.115 163)",
		"--code-success": "oklch(0.420 0.115 163)"
	}
}
