{
	"id": "oqto-brutal",
	"name": "Oqto Brutal",
	"mode": "dark",
	"system": "base24",
	"slots": {
		"base00": "#0b0a09",
		"base01": "#151412",
		"base02": "#2e2d2b",
		"base03": "#75716e",
		"base04": "#a3a09b",
		"base05": "#ecebe9",
		"base06": "#f2f1ed",
		"base07": "#faf9f6",
		"base08": "#d39a93",
		"base09": "#cfa580",
		"base0A": "#cdbb86",
		"base0B": "#9cbb9f",
		"base0C": "#93b9b4",
		"base0D": "#9fb0c9",
		"base0E": "#b7a5c9",
		"base0F": "#bba390",
		"base10": "#21201e",
		"base11": "#151412",
		"base12": "#e0aea8",
		"base13": "#dccb98",
		"base14": "#b0cdb2",
		"base15": "#a9cbc6",
		"base16": "#b4c3d8",
		"base17": "#c8b8d8"
	},
	"roles": {
		"primary": "base05",
		"ring": "base05",
		"border": "base02",
		"input": "base02",
		"muted": "base10"
	},
	"overrides": {
		"--primary-foreground": "#151412",
		"--success-foreground": "#151412",
		"--warning-foreground": "#151412",
		"--info-foreground": "#151412",
		"--destructive-foreground": "#151412",
		"--sidebar-primary-foreground": "#151412",
		"--chart-1": "#ecebe9",
		"--chart-2": "#a3a09b",
		"--chart-3": "#75716e",
		"--chart-4": "#55524f",
		"--chart-5": "#3a3836",
		"--terminal-bg": "#151412",
		"--code-bg": "#21201e",
		"--code-inline-bg": "#21201e",
		"--code-fg": "#ecebe9",
		"--code-border": "#2e2d2b",
		"--code-accent": "#ecebe9",
		"--code-success": "#9cbb9f"
	}
}
