{
	"id": "oqto-chalk",
	"name": "Oqto Chalk",
	"mode": "light",
	"system": "base24",
	"slots": {
		"base00": "#f6f7f6",
		"base01": "#ffffff",
		"base02": "#deeae3",
		"base03": "#7a857e",
		"base04": "#58645d",
		"base05": "#1d2622",
		"base06": "#141c18",
		"base07": "#0e1411",
		"base08": "#a12f31",
		"base09": "#915016",
		"base0A": "#746208",
		"base0B": "#136b4f",
		"base0C": "#006a64",
		"base0D": "#28629f",
		"base0E": "#705199",
		"base0F": "#6d513c",
		"base10": "#edf0ee",
		"base11": "#e9ecea",
		"base12": "#ca5553",
		"base13": "#ac9840",
		"base14": "#1f8a66",
		"base15": "#268b85",
		"base16": "#467db9",
		"base17": "#9375bd"
	},
	"roles": {
		"border": "base03",
		"input": "base03",
		"muted": "base10"
	},
	"overrides": {
		"--primary-foreground": "#ffffff",
		"--success-foreground": "#ffffff",
		"--warning-foreground": "#ffffff",
		"--info-foreground": "#ffffff",
		"--destructive-foreground": "#ffffff",
		"--sidebar-primary-foreground": "#ffffff",
		"--chart-1": "#136b4f",
		"--chart-2": "#7a857e",
		"--chart-3": "#66716a",
		"--chart-4": "#58645d",
		"--chart-5": "#46514b",
		"--terminal-bg": "#e9ecea",
		"--code-bg": "#edf0ee",
		"--code-inline-bg": "#e9ecea",
		"--code-fg": "#1d2622",
		"--code-border": "#d3d9d5",
		"--code-accent": "#136b4f",
		"--code-success": "#0f5a42"
	}
}
